[
  {
    "ecu_family": "DDE",
    "sgbd": "d72n47a0",
    "function_type": "live_data",
    "category": "engine",
    "canonical_id": "ENGINE.RPM",
    "name_ru": "Обороты двигателя",
    "name_en": "Engine speed",
    "source_label": "INMOT",
    "source_description": "Motordrehzahl",
    "uds": {"service": "22", "also_supported_services": ["2C"], "identifier": "5955"},
    "decode": {"type": "unsigned int", "multiply": 0.5, "divide": 1.0, "offset": 0.0, "unit": "rpm"},
    "source": {"kind": "OEM_PRG_DERIVED", "repository": "emdzej/ediabasx-docs-sgbd", "path": "docs/sgbd/d72n47a0.md"},
    "confidence": "OEM_PRG",
    "review_status": "reviewed"
  },
  {
    "ecu_family": "DDE",
    "sgbd": "d72n47a0",
    "function_type": "live_data",
    "category": "power",
    "canonical_id": "POWER.BATTERY_VOLTAGE",
    "name_ru": "Напряжение бортовой сети",
    "name_en": "Battery voltage",
    "source_label": "IUBAT",
    "source_description": "Batteriespannung (Sensorwert vor der Korrektur)",
    "uds": {"service": "22", "also_supported_services": ["2C"], "identifier": "5242"},
    "decode": {"type": "unsigned int", "multiply": 0.001, "divide": 1.0, "offset": 0.0, "unit": "V"},
    "source": {"kind": "OEM_PRG_DERIVED", "repository": "emdzej/ediabasx-docs-sgbd", "path": "docs/sgbd/d72n47a0.md"},
    "confidence": "OEM_PRG",
    "review_status": "reviewed"
  },
  {
    "ecu_family": "DDE",
    "sgbd": "d72n47a0",
    "function_type": "live_data",
    "category": "fuel",
    "canonical_id": "ENGINE.RAIL_PRESSURE.ACTUAL",
    "name_ru": "Фактическое давление в топливной рампе",
    "name_en": "Actual fuel rail pressure",
    "source_label": "RailP_pCurr",
    "source_description": "Raildruck - Istwert",
    "uds": {"service": "22", "also_supported_services": ["2C"], "identifier": "4748"},
    "decode": {"type": "unsigned int", "multiply": 0.045777, "divide": 1.0, "offset": 0.0, "unit": "bar"},
    "source": {"kind": "OEM_PRG_DERIVED", "repository": "emdzej/ediabasx-docs-sgbd", "path": "docs/sgbd/d72n47a0.md"},
    "confidence": "OEM_PRG",
    "review_status": "reviewed"
  },
  {
    "ecu_family": "DDE",
    "sgbd": "d72n47a0",
    "function_type": "live_data",
    "category": "air",
    "canonical_id": "ENGINE.BOOST.ACTUAL",
    "name_ru": "Фактическое давление наддува",
    "name_en": "Actual boost pressure",
    "source_label": "IPLAD",
    "source_description": "Ladedruck - Istwert",
    "uds": {"service": "22", "also_supported_services": ["2C"], "identifier": "4841"},
    "decode": {"type": "unsigned int", "multiply": 0.091554, "divide": 1.0, "offset": 0.0, "unit": "hPa"},
    "source": {"kind": "OEM_PRG_DERIVED", "repository": "emdzej/ediabasx-docs-sgbd", "path": "docs/sgbd/d72n47a0.md"},
    "confidence": "OEM_PRG",
    "review_status": "reviewed"
  },
  {
    "ecu_family": "DDE",
    "sgbd": "d72n47a0",
    "function_type": "live_data",
    "category": "air",
    "canonical_id": "ENGINE.CHARGE_AIR_TEMP",
    "name_ru": "Температура воздуха после интеркулера",
    "name_en": "Charge-air temperature after intercooler",
    "source_label": "ITLAL",
    "source_description": "Temperatur nach dem Ladeluftkühler",
    "uds": {"service": "22", "also_supported_services": ["2C"], "identifier": "4843"},
    "decode": {"type": "unsigned int", "multiply": 0.01, "divide": 1.0, "offset": -100.0, "unit": "°C"},
    "source": {"kind": "OEM_PRG_DERIVED", "repository": "emdzej/ediabasx-docs-sgbd", "path": "docs/sgbd/d72n47a0.md"},
    "confidence": "OEM_PRG",
    "review_status": "reviewed"
  },
  {
    "ecu_family": "DDE",
    "sgbd": "d72n47a0",
    "function_type": "live_data",
    "category": "air",
    "canonical_id": "ENGINE.INTAKE_AIR_TEMP",
    "name_ru": "Температура впускного воздуха",
    "name_en": "Intake air temperature",
    "source_label": "ITANS",
    "source_description": "Lufttemperatur an der HFM-Position",
    "uds": {"service": "22", "also_supported_services": ["2C"], "identifier": "4846"},
    "decode": {"type": "unsigned int", "multiply": 0.1, "divide": 1.0, "offset": -273.14, "unit": "°C"},
    "source": {"kind": "OEM_PRG_DERIVED", "repository": "emdzej/ediabasx-docs-sgbd", "path": "docs/sgbd/d72n47a0.md"},
    "confidence": "OEM_PRG",
    "review_status": "reviewed"
  },
  {
    "ecu_family": "DDE",
    "sgbd": "d72n47a0",
    "function_type": "live_data",
    "category": "engine",
    "canonical_id": "ENGINE.OIL_TEMP",
    "name_ru": "Температура моторного масла",
    "name_en": "Engine oil temperature",
    "source_label": "Toel",
    "source_description": "Ausgabewert Motoröltemperatur für LoCAN",
    "uds": {"service": "22", "also_supported_services": ["2C"], "identifier": "428E"},
    "decode": {"type": "unsigned int", "multiply": 0.005417, "divide": 1.0, "offset": -100.0, "unit": "°C"},
    "source": {"kind": "OEM_PRG_DERIVED", "repository": "emdzej/ediabasx-docs-sgbd", "path": "docs/sgbd/d72n47a0.md"},
    "confidence": "OEM_PRG",
    "review_status": "reviewed"
  },
  {
    "ecu_family": "DDE",
    "sgbd": "d72n47a0",
    "function_type": "live_data",
    "category": "vehicle",
    "canonical_id": "VEHICLE.SPEED",
    "name_ru": "Скорость автомобиля",
    "name_en": "Vehicle speed",
    "source_label": "OBD_PID0D_VehV_vSens",
    "source_description": "Fahrzeuggeschwindigkeit",
    "uds": {"service": "22", "also_supported_services": ["2C"], "identifier": "520D"},
    "decode": {"type": "unsigned char", "multiply": 1.0, "divide": 1.0, "offset": 0.0, "unit": "km/h"},
    "source": {"kind": "OEM_PRG_DERIVED", "repository": "emdzej/ediabasx-docs-sgbd", "path": "docs/sgbd/d72n47a0.md"},
    "confidence": "OEM_PRG",
    "review_status": "reviewed"
  },
  {
    "ecu_family": "DDE",
    "sgbd": "d72n47a0",
    "function_type": "activation",
    "category": "air",
    "canonical_id": "ENGINE.THROTTLE.ACTUATOR",
    "name_ru": "Активация дроссельной заслонки",
    "name_en": "Throttle actuator test",
    "source_label": "DRO",
    "source_description": "Drosselklappe",
    "uds": {"service": "2F", "identifier": "602A"},
    "control": {"value_min": 5, "value_max": 95, "factor": 0.01, "safe_default": false},
    "requirements": {"notes": ["Использовать штатные STEUERN_SELECTIV/STEUERN_ENDE_SELECTIV semantics и всегда возвращать управление ECU."]},
    "source": {"kind": "OEM_PRG_DERIVED", "repository": "emdzej/ediabasx-docs-sgbd", "path": "docs/sgbd/d72n47a0.md"},
    "confidence": "OEM_PRG",
    "review_status": "reviewed"
  },
  {
    "ecu_family": "DDE",
    "sgbd": "d72n47a0",
    "function_type": "activation",
    "category": "turbo",
    "canonical_id": "ENGINE.BOOST_ACTUATOR",
    "name_ru": "Активация привода регулировки наддува",
    "name_en": "Boost-pressure actuator test",
    "source_label": "LDS",
    "source_description": "Ladedrucksteller",
    "uds": {"service": "2F", "identifier": "60B6"},
    "control": {"value_min": 5, "value_max": 95, "factor": 0.01, "safe_default": false},
    "requirements": {"notes": ["После теста обязательно вернуть управление ECU."]},
    "source": {"kind": "OEM_PRG_DERIVED", "repository": "emdzej/ediabasx-docs-sgbd", "path": "docs/sgbd/d72n47a0.md"},
    "confidence": "OEM_PRG",
    "review_status": "reviewed"
  },
  {
    "ecu_family": "DDE",
    "sgbd": "d72n47a0",
    "function_type": "activation",
    "category": "air",
    "canonical_id": "ENGINE.SWIRL_FLAP.ACTUATOR",
    "name_ru": "Активация вихревых заслонок",
    "name_en": "Swirl-flap actuator test",
    "source_label": "DRA",
    "source_description": "Drallklappe",
    "uds": {"service": "2F", "identifier": "60BC"},
    "control": {"value_min": 5, "value_max": 95, "factor": 0.01220703125, "safe_default": false},
    "requirements": {"notes": ["После теста обязательно вернуть управление ECU."]},
    "source": {"kind": "OEM_PRG_DERIVED", "repository": "emdzej/ediabasx-docs-sgbd", "path": "docs/sgbd/d72n47a0.md"},
    "confidence": "OEM_PRG",
    "review_status": "reviewed"
  },
  {
    "ecu_family": "DDE",
    "sgbd": "d72n47a0",
    "function_type": "activation",
    "category": "egr",
    "canonical_id": "ENGINE.EGR.ACTUATOR",
    "name_ru": "Активация клапана EGR",
    "name_en": "EGR valve actuator test",
    "source_label": "AGR",
    "source_description": "Abgasrückführung",
    "uds": {"service": "2F", "identifier": "60BE"},
    "control": {"value_min": 5, "value_max": 95, "factor": 0.01220703125, "safe_default": false},
    "requirements": {"notes": ["После теста обязательно вернуть управление ECU."]},
    "source": {"kind": "OEM_PRG_DERIVED", "repository": "emdzej/ediabasx-docs-sgbd", "path": "docs/sgbd/d72n47a0.md"},
    "confidence": "OEM_PRG",
    "review_status": "reviewed"
  },
  {
    "ecu_family": "DDE",
    "sgbd": "d72n47a0",
    "function_type": "activation",
    "category": "fuel",
    "canonical_id": "ENGINE.FUEL_PUMP.ACTUATOR",
    "name_ru": "Активация подкачивающего топливного насоса",
    "name_en": "Low-pressure fuel pump actuator test",
    "source_label": "KPC",
    "source_description": "Vorförderpumpe EKP über CAN",
    "uds": {"service": "2F", "identifier": "60D8"},
    "control": {"value_min": 0, "value_max": 250, "factor": 0.01, "safe_default": false},
    "requirements": {"notes": ["После теста обязательно вернуть управление ECU."]},
    "source": {"kind": "OEM_PRG_DERIVED", "repository": "emdzej/ediabasx-docs-sgbd", "path": "docs/sgbd/d72n47a0.md"},
    "confidence": "OEM_PRG",
    "review_status": "reviewed"
  },
  {
    "ecu_family": "DDE",
    "sgbd": "d72n47a0",
    "function_type": "activation",
    "category": "cooling",
    "canonical_id": "ENGINE.COOLING_FAN.ACTUATOR",
    "name_ru": "Активация вентилятора охлаждения двигателя",
    "name_en": "Engine cooling fan actuator test",
    "source_label": "ELU",
    "source_description": "Motorlüfter",
    "uds": {"service": "2F", "identifier": "60DA"},
    "control": {"value_min": 8, "value_max": 93, "factor": 0.01, "safe_default": false},